{
 "name": "cc-skills",
 "version": "23.0.0",
 "description": "Claude Code Skills Marketplace",
 "owner": {
  "name": "<user>ca",
  "url": "https://github.com/terrylica"
 },
 "plugins": [
  {
   "name": "notes-commander",
   "description": "macOS Notes organizer + human-in-the-loop drafts. Inventory every account/folder, export all notes to local markdown+manifest snapshots, reorganize safely (folderize/move/merge, dry-run first, no delete verb), audit-and-propose taxonomy, and the migrated draft-hold skill - all on one hardened AppleScript engine (silent-failure detection, transient-error retry, read-back verify).",
   "version": "23.0.0",
   "source": "./plugins/notes-commander",
   "category": "productivity",
   "author": {
    "name": "<user>ca",
    "url": "https://github.com/terrylica"
   },
   "keywords": [
    "apple-notes",
    "notes",
    "organizer",
    "export",
    "backup",
    "folderize",
    "draft",
    "human-in-the-loop",
    "applescript",
    "macos",
    "provenance"
   ],
   "strict": false
  },
  {
   "name": "agent-reach",
   "description": "Give your AI agent eyes to see the entire internet. Search and read 15+ platforms with auto-update preflight: Twitter/X, Reddit, YouTube, GitHub, Bilibili, XiaoHongShu, Douyin, Weibo, WeChat, Xiaoyuzhou Podcast, LinkedIn, V2EX, RSS, Exa web search.",
   "version": "23.0.0",
   "source": "./plugins/agent-reach",
   "category": "productivity",
   "author": {
    "name": "<user>ca",
    "url": "https://github.com/terrylica"
   },
   "keywords": [
    "agent-reach",
    "web-search",
    "twitter",
    "reddit",
    "youtube",
    "bilibili",
    "xiaohongshu",
    "douyin",
    "weibo",
    "wechat",
    "linkedin",
    "v2ex",
    "rss",
    "exa",
    "internet",
    "scraping"
   ],
   "strict": false
  },
  {
   "name": "asciinema-tools",
   "description": "Terminal recording automation: asciinema capture, launchd daemon for background chunking, Keychain PAT storage, Pushover notifications, cast conversion, and semantic analysis",
   "version": "23.0.0",
   "source": "./plugins/asciinema-tools",
   "category": "utilities",
   "author": {
    "name": "<user>ca",
    "url": "https://github.com/terrylica"
   },
   "keywords": [
    "asciinema",
    "recording",
    "terminal",
    "cast",
    "streaming",
    "backup",
    "analysis",
    "launchd",
    "daemon",
    "keychain",
    "pushover"
   ],
   "strict": false
  },
  {
   "name": "calcom-commander",
   "description": "Cal.com + Telegram bot lifecycle - booking management, interactive commands, scheduled sync, Agent SDK routing, 1Password API key",
   "version": "23.0.0",
   "source": "./plugins/calcom-commander",
   "category": "productivity",
   "author": {
    "name": "<user>ca",
    "url": "https://github.com/terrylica"
   },
   "keywords": [
    "calcom",
    "cal.com",
    "calendar",
    "booking",
    "scheduling",
    "telegram",
    "bot",
    "cloud-run",
    "gcp",
    "supabase",
    "agent-sdk",
    "1password",
    "mise",
    "bun"
   ],
   "strict": false
  },
  {
   "name": "claude-tts-companion",
   "description": "Real-time karaoke subtitles synced with TTS playback — unified macOS accessory app replacing telegram-bot + kokoro-tts-server + subtitle prototype",
   "version": "23.0.0",
   "source": "./plugins/claude-tts-companion",
   "category": "productivity",
   "author": {
    "name": "<user>ca",
    "url": "https://github.com/terrylica"
   },
   "keywords": [
    "tts",
    "subtitles",
    "karaoke",
    "macos",
    "swift",
    "telegram",
    "sherpa-onnx",
    "kokoro"
   ],
   "strict": false
  },
  {
   "name": "cli-anything",
   "description": "Reference guide for CLI-Anything: auto-generate production-ready agent-controllable CLI harnesses for any GUI app via 7-phase pipeline. Covers all validated commands, per-app examples (GIMP, Blender, LibreOffice, Inkscape), testing, and HARNESS.md methodology.",
   "version": "23.0.0",
   "source": "./plugins/cli-anything",
   "category": "development",
   "author": {
    "name": "<user>ca",
    "url": "https://github.com/terrylica"
   },
   "keywords": [
    "cli",
    "gui",
    "harness",
    "agent",
    "cli-anything",
    "gimp",
    "blender",
    "libreoffice",
    "inkscape",
    "click",
    "repl",
    "automation"
   ],
   "strict": false
  },
  {
   "name": "crucible",
   "description": "Self-evolving research methodology: 18 universal principles for LLM-driven investigation, distilled from a 376-turn session with 1 positive + 17 null campaigns. Covers epistemic foundations (causality, nulls, record-keeping), investigation patterns (multi-lens agents, adversarial gates, per-trade enrichment), decision layer (constraint-pivot, supersede-not-rewrite), and emergent resurrection (failure archive with resurrect_if conditions).",
   "version": "23.0.0",
   "author": {
    "name": "<user>ca",
    "url": "https://github.com/terrylica"
   },
   "keywords": [
    "research-methodology",
    "self-evolving",
    "adversarial-gates",
    "shuffled-null",
    "genetic-evolutionary",
    "agnostic-principles",
    "llm-investigation"
   ],
   "strict": false,
   "source": "./plugins/crucible",
   "category": "ai"
  },
  {
   "name": "devops-tools",
   "description": "DevOps automation: ClickHouse, Doppler, MLflow, Cloudflare Workers, pueue orchestration, notifications, session recovery, MiniMax consensus analysis",
   "version": "23.0.0",
   "source": "./plugins/devops-tools",
   "category": "devops",
   "author": {
    "name": "<user>ca",
    "url": "https://github.com/terrylica"
   },
   "keywords": [
    "doppler",
    "credentials",
    "secrets",
    "mlflow",
    "session-recovery",
    "session-blind-spots",
    "consensus-analysis",
    "minimax",
    "pushover",
    "watchexec",
    "notifications",
    "loguru",
    "platformdirs",
    "structured-logging",
    "jsonl",
    "project-directory-migration",
    "proxy",
    "oauth",
    "claude-code-proxy",
    "anthropic-base-url",
    "model-routing"
   ],
   "strict": false
  },
  {
   "name": "doc-tools",
   "description": "Comprehensive documentation: ASCII diagrams, markdown standards, LaTeX build, Pandoc PDF generation",
   "version": "23.0.0",
   "source": "./plugins/doc-tools",
   "category": "documents",
   "author": {
    "name": "<user>ca",
    "url": "https://github.com/terrylica"
   },
   "keywords": [
    "ascii",
    "diagrams",
    "documentation",
    "markdown",
    "standards",
    "validation",
    "latex",
    "pandoc",
    "pdf",
    "build",
    "tables"
   ],
   "strict": false
  },
  {
   "name": "dotfiles-tools",
   "description": "Chezmoi dotfile management via natural language workflows",
   "version": "23.0.0",
   "source": "./plugins/dotfiles-tools",
   "category": "utilities",
   "author": {
    "name": "<user>ca",
    "url": "https://github.com/terrylica"
   },
   "keywords": [
    "chezmoi",
    "dotfiles",
    "configuration",
    "sync",
    "git"
   ],
   "strict": false
  },
  {
   "name": "floating-clock",
   "description": "Always-on-top floating desktop clock for macOS — borderless NSPanel with persistent positioning, timer-driven updates, persistent position via NSUserDefaults.",
   "version": "23.0.0",
   "source": "./plugins/floating-clock",
   "category": "utilities",
   "author": {
    "name": "<user>ca",
    "url": "https://github.com/terrylica"
   },
   "keywords": [
    "macos",
    "clock",
    "floating-window",
    "nspanel",
    "objective-c",
    "minimal-footprint",
    "always-on-top",
    "draggable"
   ],
   "strict": false
  },
  {
   "name": "gemini-deep-research",
   "description": "Gemini Deep Research via browser automation: Playwright CDP, 8-step flow, 40k+ char research reports",
   "version": "23.0.0",
   "source": "./plugins/gemini-deep-research",
   "category": "ai",
   "author": {
    "name": "<user>ca",
    "url": "https://github.com/terrylica"
   },
   "keywords": [
    "gemini",
    "deep-research",
    "browser-automation",
    "playwright",
    "cdp",
    "research",
    "google"
   ],
   "strict": false
  },
  {
   "name": "gh-tools",
   "description": "GitHub workflow automation: GFM link validation, WebFetch enforcement, issue management, fork intelligence",
   "version": "23.0.0",
   "source": "./plugins/gh-tools",
   "category": "development",
   "author": {
    "name": "<user>ca",
    "url": "https://github.com/terrylica"
   },
   "keywords": [
    "github",
    "pull-request",
    "gfm",
    "link-validation",
    "gh-cli",
    "webfetch",
    "enforcement"
   ],
   "strict": false
  },
  {
   "name": "git-town-workflow",
   "description": "Prescriptive git-town workflow enforcement for fork-based development: fork creation, contribution workflow, enforcement hooks that block forbidden raw git commands",
   "version": "23.0.0",
   "source": "./plugins/git-town-workflow",
   "category": "devops",
   "author": {
    "name": "<user>ca",
    "url": "https://github.com/terrylica"
   },
   "keywords": [
    "git-town",
    "fork",
    "workflow",
    "contribution",
    "upstream",
    "branch",
    "prescriptive",
    "hooks",
    "enforcement"
   ],
   "strict": false
  },
  {
   "name": "gmail-commander",
   "description": "Gmail + Telegram bot lifecycle - email triage, interactive commands, voice digest, Agent SDK routing, 1Password OAuth",
   "version": "23.0.0",
   "source": "./plugins/gmail-commander",
   "category": "productivity",
   "author": {
    "name": "<user>ca",
    "url": "https://github.com/terrylica"
   },
   "keywords": [
    "gmail",
    "email",
    "telegram",
    "bot",
    "triage",
    "digest",
    "voice",
    "agent-sdk",
    "oauth",
    "1password",
    "mise",
    "bun"
   ],
   "strict": false
  },
  {
   "name": "graphify-tools",